{
  "contract_version": "1.0",
  "fictional": true,
  "period_days": 7,
  "planning_budget_eur": 5000,
  "rows": [
    {
      "country": "HU",
      "sku": "NOVA-W1",
      "channel": "online",
      "period": "2026-09-14",
      "currency": "EUR",
      "category": "smartwatch",
      "price_eur": 169,
      "cost_eur": 90,
      "channel_fee_pct": 0.08,
      "return_handling_eur": 8,
      "opening_stock_units": 190,
      "sell_in_units": 0,
      "sell_out_units": 46,
      "returns_units": 2,
      "closing_stock_units": 144,
      "inbound_units": 80,
      "inbound_due_days": 5,
      "lead_time_days": 21,
      "discount_pct": 0.08,
      "content_readiness": 0.8,
      "traffic_index": 0.7,
      "listed": true,
      "marketing_spend_eur": 250,
      "seasonality_index": 1.0,
      "scenario": "sport",
      "provenance": "fictional_fixture"
    },
    {
      "country": "HU",
      "sku": "NOVA-W1",
      "channel": "online",
      "period": "2026-09-21",
      "currency": "EUR",
      "category": "smartwatch",
      "price_eur": 169,
      "cost_eur": 90,
      "channel_fee_pct": 0.08,
      "return_handling_eur": 8,
      "opening_stock_units": 144,
      "sell_in_units": 40,
      "sell_out_units": 48,
      "returns_units": 2,
      "closing_stock_units": 136,
      "inbound_units": 80,
      "inbound_due_days": 5,
      "lead_time_days": 21,
      "discount_pct": 0.08,
      "content_readiness": 0.8,
      "traffic_index": 0.7,
      "listed": true,
      "marketing_spend_eur": 250,
      "seasonality_index": 1.0,
      "scenario": "sport",
      "provenance": "fictional_fixture"
    },
    {
      "country": "HU",
      "sku": "NOVA-W1",
      "channel": "online",
      "period": "2026-09-28",
      "currency": "EUR",
      "category": "smartwatch",
      "price_eur": 169,
      "cost_eur": 90,
      "channel_fee_pct": 0.08,
      "return_handling_eur": 8,
      "opening_stock_units": 136,
      "sell_in_units": 0,
      "sell_out_units": 50,
      "returns_units": 2,
      "closing_stock_units": 86,
      "inbound_units": 80,
      "inbound_due_days": 5,
      "lead_time_days": 21,
      "discount_pct": 0.08,
      "content_readiness": 0.8,
      "traffic_index": 0.7,
      "listed": true,
      "marketing_spend_eur": 250,
      "seasonality_index": 1.0,
      "scenario": "sport",
      "provenance": "fictional_fixture"
    },
    {
      "country": "HU",
      "sku": "NOVA-W1",
      "channel": "retail",
      "period": "2026-09-14",
      "currency": "EUR",
      "category": "smartwatch",
      "price_eur": 169,
      "cost_eur": 90,
      "channel_fee_pct": 0.08,
      "return_handling_eur": 8,
      "opening_stock_units": 190,
      "sell_in_units": 0,
      "sell_out_units": 38,
      "returns_units": 2,
      "closing_stock_units": 152,
      "inbound_units": 80,
      "inbound_due_days": 5,
      "lead_time_days": 21,
      "discount_pct": 0.08,
      "content_readiness": 0.8,
      "traffic_index": 0.7,
      "listed": true,
      "marketing_spend_eur": 250,
      "seasonality_index": 1.0,
      "scenario": "sport",
      "provenance": "fictional_fixture"
    },
    {
      "country": "HU",
      "sku": "NOVA-W1",
      "channel": "retail",
      "period": "2026-09-21",
      "currency": "EUR",
      "category": "smartwatch",
      "price_eur": 169,
      "cost_eur": 90,
      "channel_fee_pct": 0.08,
      "return_handling_eur": 8,
      "opening_stock_units": 152,
      "sell_in_units": 40,
      "sell_out_units": 40,
      "returns_units": 2,
      "closing_stock_units": 152,
      "inbound_units": 80,
      "inbound_due_days": 5,
      "lead_time_days": 21,
      "discount_pct": 0.08,
      "content_readiness": 0.8,
      "traffic_index": 0.7,
      "listed": true,
      "marketing_spend_eur": 250,
      "seasonality_index": 1.0,
      "scenario": "sport",
      "provenance": "fictional_fixture"
    },
    {
      "country": "HU",
      "sku": "NOVA-W1",
      "channel": "retail",
      "period": "2026-09-28",
      "currency": "EUR",
      "category": "smartwatch",
      "price_eur": 169,
      "cost_eur": 90,
      "channel_fee_pct": 0.08,
      "return_handling_eur": 8,
      "opening_stock_units": 152,
      "sell_in_units": 0,
      "sell_out_units": 42,
      "returns_units": 2,
      "closing_stock_units": 110,
      "inbound_units": 80,
      "inbound_due_days": 5,
      "lead_time_days": 21,
      "discount_pct": 0.08,
      "content_readiness": 0.8,
      "traffic_index": 0.7,
      "listed": true,
      "marketing_spend_eur": 250,
      "seasonality_index": 1.0,
      "scenario": "sport",
      "provenance": "fictional_fixture"
    },
    {
      "country": "HU",
      "sku": "NOVA-B1",
      "channel": "online",
      "period": "2026-09-14",
      "currency": "EUR",
      "category": "earbuds",
      "price_eur": 89,
      "cost_eur": 38,
      "channel_fee_pct": 0.08,
      "return_handling_eur": 8,
      "opening_stock_units": 280,
      "sell_in_units": 0,
      "sell_out_units": 49,
      "returns_units": 2,
      "closing_stock_units": 231,
      "inbound_units": 80,
      "inbound_due_days": 5,
      "lead_time_days": 21,
      "discount_pct": 0.15,
      "content_readiness": 0.8,
      "traffic_index": 0.7,
      "listed": true,
      "marketing_spend_eur": 250,
      "seasonality_index": 1.0,
      "scenario": "commute",
      "provenance": "fictional_fixture"
    },
    {
      "country": "HU",
      "sku": "NOVA-B1",
      "channel": "online",
      "period": "2026-09-21",
      "currency": "EUR",
      "category": "earbuds",
      "price_eur": 89,
      "cost_eur": 38,
      "channel_fee_pct": 0.08,
      "return_handling_eur": 8,
      "opening_stock_units": 231,
      "sell_in_units": 40,
      "sell_out_units": 51,
      "returns_units": 2,
      "closing_stock_units": 220,
      "inbound_units": 80,
      "inbound_due_days": 5,
      "lead_time_days": 21,
      "discount_pct": 0.15,
      "content_readiness": 0.8,
      "traffic_index": 0.7,
      "listed": true,
      "marketing_spend_eur": 250,
      "seasonality_index": 1.0,
      "scenario": "commute",
      "provenance": "fictional_fixture"
    },
    {
      "country": "HU",
      "sku": "NOVA-B1",
      "channel": "online",
      "period": "2026-09-28",
      "currency": "EUR",
      "category": "earbuds",
      "price_eur": 89,
      "cost_eur": 38,
      "channel_fee_pct": 0.08,
      "return_handling_eur": 8,
      "opening_stock_units": 220,
      "sell_in_units": 0,
      "sell_out_units": 53,
      "returns_units": 2,
      "closing_stock_units": 167,
      "inbound_units": 80,
      "inbound_due_days": 5,
      "lead_time_days": 21,
      "discount_pct": 0.15,
      "content_readiness": 0.8,
      "traffic_index": 0.7,
      "listed": true,
      "marketing_spend_eur": 250,
      "seasonality_index": 1.0,
      "scenario": "commute",
      "provenance": "fictional_fixture"
    },
    {
      "country": "HU",
      "sku": "NOVA-B1",
      "channel": "retail",
      "period": "2026-09-14",
      "currency": "EUR",
      "category": "earbuds",
      "price_eur": 89,
      "cost_eur": 38,
      "channel_fee_pct": 0.08,
      "return_handling_eur": 8,
      "opening_stock_units": 280,
      "sell_in_units": 0,
      "sell_out_units": 41,
      "returns_units": 2,
      "closing_stock_units": 239,
      "inbound_units": 80,
      "inbound_due_days": 5,
      "lead_time_days": 21,
      "discount_pct": 0.15,
      "content_readiness": 0.45,
      "traffic_index": 0.7,
      "listed": true,
      "marketing_spend_eur": 250,
      "seasonality_index": 1.0,
      "scenario": "commute",
      "provenance": "fictional_fixture"
    },
    {
      "country": "HU",
      "sku": "NOVA-B1",
      "channel": "retail",
      "period": "2026-09-21",
      "currency": "EUR",
      "category": "earbuds",
      "price_eur": 89,
      "cost_eur": 38,
      "channel_fee_pct": 0.08,
      "return_handling_eur": 8,
      "opening_stock_units": 239,
      "sell_in_units": 40,
      "sell_out_units": 43,
      "returns_units": 2,
      "closing_stock_units": 236,
      "inbound_units": 80,
      "inbound_due_days": 5,
      "lead_time_days": 21,
      "discount_pct": 0.15,
      "content_readiness": 0.45,
      "traffic_index": 0.7,
      "listed": true,
      "marketing_spend_eur": 250,
      "seasonality_index": 1.0,
      "scenario": "commute",
      "provenance": "fictional_fixture"
    },
    {
      "country": "HU",
      "sku": "NOVA-B1",
      "channel": "retail",
      "period": "2026-09-28",
      "currency": "EUR",
      "category": "earbuds",
      "price_eur": 89,
      "cost_eur": 38,
      "channel_fee_pct": 0.08,
      "return_handling_eur": 8,
      "opening_stock_units": 236,
      "sell_in_units": 0,
      "sell_out_units": 45,
      "returns_units": 2,
      "closing_stock_units": 191,
      "inbound_units": 80,
      "inbound_due_days": 5,
      "lead_time_days": 21,
      "discount_pct": 0.15,
      "content_readiness": 0.45,
      "traffic_index": 0.7,
      "listed": true,
      "marketing_spend_eur": 250,
      "seasonality_index": 1.0,
      "scenario": "commute",
      "provenance": "fictional_fixture"
    },
    {
      "country": "HU",
      "sku": "NOVA-T1",
      "channel": "online",
      "period": "2026-09-14",
      "currency": "EUR",
      "category": "tablet",
      "price_eur": 299,
      "cost_eur": 225,
      "channel_fee_pct": 0.08,
      "return_handling_eur": 8,
      "opening_stock_units": 370,
      "sell_in_units": 0,
      "sell_out_units": 52,
      "returns_units": 2,
      "closing_stock_units": 318,
      "inbound_units": 80,
      "inbound_due_days": 5,
      "lead_time_days": 21,
      "discount_pct": 0.15,
      "content_readiness": 0.8,
      "traffic_index": 0.7,
      "listed": true,
      "marketing_spend_eur": 250,
      "seasonality_index": 1.0,
      "scenario": "gift",
      "provenance": "fictional_fixture"
    },
    {
      "country": "HU",